{
  "schema_version": "employee_guide.v0",
  "guide_id": "GUIDE-IDENTITY-PASSWORD-RESET",
  "version_no": 1,
  "title": "비밀번호 재설정 중 오류가 날 때",
  "language": "ko",
  "status": "DRAFT",
  "document_type": "EMPLOYEE_GUIDE",
  "service_id": "IDENTITY",
  "access": {"access_scope": "EMPLOYEE", "exposure_policy": "QUOTABLE", "ingest_status": "PENDING"},
  "applies_when": ["공식 셀프서비스 비밀번호 재설정 중 요청 처리 오류가 표시됨", "등록 연락처로 본인 확인을 완료할 수 없음"],
  "user_phrases": ["비밀번호 재설정 요청을 처리할 수 없다고 나와요.", "재설정 인증 연락이 오지 않아요."],
  "steps": [
    {"order": 1, "instruction": "오류 화면에서 다른 승인된 인증 방법을 선택할 수 있는지 확인합니다.", "expected_result": "사용 가능한 다른 인증 방법이 있으면 재설정을 계속할 수 있습니다."},
    {"order": 2, "instruction": "표시된 전화번호 끝자리 등 본인이 볼 수 있는 비민감 정보만 확인합니다.", "expected_result": "등록 연락처가 현재 사용하는 연락처와 다른지 판단할 수 있습니다."},
    {"order": 3, "instruction": "오류가 반복되거나 연락처가 다르면 더 시도하지 말고 오류 문구와 발생 시각을 기록해 Hops에 문의합니다.", "expected_result": "계정 권한 담당자가 등록 연락처와 계정 상태를 검토합니다."}
  ],
  "stop_and_handoff": ["다른 인증 방법이 없음", "표시된 연락처가 현재 연락처와 다름", "요청 처리 오류가 반복됨"],
  "information_to_collect": ["발생 시각", "안전한 오류 문구", "다른 인증 방법 표시 여부", "등록 연락처가 현재 정보와 일치하는지 여부"],
  "do_not_do": ["전체 전화번호·비밀번호·인증 코드를 문의에 입력하지 않기", "오류가 반복될 때 재설정 요청을 계속 보내지 않기", "관리자 화면이나 계정 설정을 임의로 변경하지 않기"],
  "related_runbook_ids": [],
  "provenance": {"source_type": "SYNTHESIZED_FROM_APPROVED_SOURCE_EVIDENCE", "source_evidence_ids": ["GE-002"], "created_at": "2026-10-26"},
  "review": {"content_status": "OWNER_CONFIRMED", "reviewer": "DATA_OWNER", "reviewed_at": "2026-10-26", "team_review_status": "PENDING"}
}
